{
  "$schema": "https://json-schema.org/draft/2020-12/schema",
  "$id": "https://github.com/auction-promax/api/security/schemas/vulnerability-scan-contract.schema.json",
  "title": "Cycle 3 Vulnerability Scan Execution Contract",
  "description": "Fail-closed contract for direct Trivy 0.74.0 SBOM and npm lockfile vulnerability scans. Database freshness is verified before scanner invocation; raw reports are temporary only and policy evaluation is mandatory.",
  "type": "object",
  "additionalProperties": false,
  "required": ["schemaVersion", "scanner", "database", "scans", "reportHandling", "policy"],
  "properties": {
    "schemaVersion": { "const": 1 },
    "scanner": { "$ref": "#/$defs/scanner" },
    "database": { "$ref": "#/$defs/database" },
    "scans": {
      "type": "array",
      "prefixItems": [
        { "$ref": "#/$defs/identityScan" },
        { "$ref": "#/$defs/infraScan" }
      ],
      "minItems": 2,
      "maxItems": 2,
      "items": false
    },
    "reportHandling": { "$ref": "#/$defs/reportHandling" },
    "policy": { "$ref": "#/$defs/policy" }
  },
  "$defs": {
    "scanner": {
      "type": "object",
      "additionalProperties": false,
      "required": ["name", "version", "installation"],
      "properties": {
        "name": { "const": "trivy" },
        "version": { "const": "0.74.0" },
        "installation": { "const": "cycle-1-verified-bootstrap" }
      }
    },
    "database": {
      "type": "object",
      "additionalProperties": false,
      "required": ["cacheRelativePath", "authoritativeUpdatedAt", "maxAgeHours", "futureClockSkewSeconds", "refreshBeforeScanWhenStale", "scannerArgumentsAfterFreshnessVerification"],
      "properties": {
        "cacheRelativePath": { "const": ".tools/supply-chain/trivy-cache" },
        "authoritativeUpdatedAt": { "const": "VulnerabilityDB.UpdatedAt" },
        "maxAgeHours": { "const": 24 },
        "futureClockSkewSeconds": { "const": 300 },
        "refreshBeforeScanWhenStale": { "const": true },
        "scannerArgumentsAfterFreshnessVerification": { "const": ["--skip-db-update"] }
      }
    },
    "identityScan": {
      "type": "object",
      "additionalProperties": false,
      "required": ["id", "command", "input", "targetType", "expectedEcosystem", "arguments"],
      "properties": {
        "id": { "const": "identity-sbom" },
        "command": { "const": "sbom" },
        "input": { "const": "services/identity-profile-service/target/bom.json" },
        "targetType": { "const": "sbom" },
        "expectedEcosystem": { "const": "maven" },
        "arguments": { "const": ["--scanners", "vuln", "--format", "json", "--quiet", "--exit-code", "0", "--skip-db-update"] }
      }
    },
    "infraScan": {
      "type": "object",
      "additionalProperties": false,
      "required": ["id", "command", "input", "targetType", "expectedEcosystem", "arguments"],
      "properties": {
        "id": { "const": "infra-package-lock" },
        "command": { "const": "filesystem" },
        "input": { "const": "infra/package-lock.json" },
        "targetType": { "const": "filesystem" },
        "expectedEcosystem": { "const": "npm" },
        "arguments": { "const": ["--scanners", "vuln", "--include-dev-deps", "--format", "json", "--quiet", "--exit-code", "0", "--skip-db-update"] }
      }
    },
    "reportHandling": {
      "type": "object",
      "additionalProperties": false,
      "required": ["rawReports", "sanitizedInventoryFields"],
      "properties": {
        "rawReports": { "const": "temporary-only" },
        "sanitizedInventoryFields": {
          "const": ["scanner", "findingId", "source", "targetType", "target", "package/component", "affectedVersion", "fixedVersion", "severity", "severitySource", "status", "dispositionId"]
        }
      }
    },
    "policy": {
      "type": "object",
      "additionalProperties": false,
      "required": ["mustRun", "highAndCritical", "mediumAndLow", "unknown", "ignoreUnfixed"],
      "properties": {
        "mustRun": { "const": true },
        "highAndCritical": { "const": "fail-unless-exact-valid-disposition" },
        "mediumAndLow": { "const": "report-non-blocking" },
        "unknown": { "const": "fail-closed" },
        "ignoreUnfixed": { "const": false }
      }
    }
  }
}
