{
  "schemaVersion": 1,
  "scanner": {
    "name": "trivy",
    "version": "0.74.0",
    "installation": "cycle-1-verified-bootstrap"
  },
  "database": {
    "cacheRelativePath": ".tools/supply-chain/trivy-cache",
    "authoritativeUpdatedAt": "VulnerabilityDB.UpdatedAt",
    "maxAgeHours": 24,
    "futureClockSkewSeconds": 300,
    "refreshBeforeScanWhenStale": true,
    "scannerArgumentsAfterFreshnessVerification": [
      "--skip-db-update"
    ]
  },
  "scans": [
    {
      "id": "identity-sbom",
      "command": "sbom",
      "input": "services/identity-profile-service/target/bom.json",
      "targetType": "sbom",
      "expectedEcosystem": "maven",
      "arguments": [
        "--scanners",
        "vuln",
        "--format",
        "json",
        "--quiet",
        "--exit-code",
        "0",
        "--skip-db-update"
      ]
    },
    {
      "id": "infra-package-lock",
      "command": "filesystem",
      "input": "infra/package-lock.json",
      "targetType": "filesystem",
      "expectedEcosystem": "npm",
      "arguments": [
        "--scanners",
        "vuln",
        "--include-dev-deps",
        "--format",
        "json",
        "--quiet",
        "--exit-code",
        "0",
        "--skip-db-update"
      ]
    }
  ],
  "reportHandling": {
    "rawReports": "temporary-only",
    "sanitizedInventoryFields": [
      "scanner",
      "findingId",
      "source",
      "targetType",
      "target",
      "package/component",
      "affectedVersion",
      "fixedVersion",
      "severity",
      "severitySource",
      "status",
      "dispositionId"
    ]
  },
  "policy": {
    "mustRun": true,
    "highAndCritical": "fail-unless-exact-valid-disposition",
    "mediumAndLow": "report-non-blocking",
    "unknown": "fail-closed",
    "ignoreUnfixed": false
  }
}
